file_name,program_name,start_time,end_time,speaker,transcription,start_time_ms,end_time_ms
7981.wav,ما الذي ينتظر الاتحاد في الموسم القادم؟,00:25:11.100000,00:25:28.410000,عبيدالله العيسي,هذا شف يقول لك الحقيقة دائمًا لها وجهان إن من جانب هم لعيبة خبرة وثقال زي قروهي وحجازي وغيرهم لكن من جانب تقدمهم في السن يخليهم ما هم قادرين يعطونك ثلاثون جولة خاصة لما يكون ما فيه دكة بدلاء تريحهم,1611000,1938000
8916.wav,ماذا يعني ارتفاع الدولار للاقتصاد العالمي,00:09:04.360000,0:09:19.177143,أحمد الحافظ,حررها محمود أبو ندى و راجعتها سحر سليمان نشوفكم بكرة الفجر,904000,736143
7821.wav,سلبية الكلاسيكو وخسارة الهلال,00:52:38.770000,00:53:09.060000,عبيدالله العيسي,هو كان يجنبك في كثير من الأحيان يجنبك فرصة واعدة إنه أنت تخلق مرتدة ضدك، دائمًا ما يكون مبادر ودائمًا ما يكون، يمكن ترى أهم ميزة في كويلار أشبهها باللي كان يصير مع ريال مدريد لما كان كاسيميرو موجود. جانب الشراسة اللي مفقود عند كروسو مودريتش هو اللي يأمن لك إياه. أتكلم عن كاريو يمكن يكون لاعب مجهوده وافر، يجري كثير يحاول  يضغط، لكن ما هو بشرس لا هو ولا سلمان ما يصنف أنه لاعب شرس، فهو هذا يجي يعوّض لك هذا النقص اللي موجود عليك.,3928000,3249000
7495.wav,الهلال بطلًا للدوري الثامن عشر,01:12:44.480000,01:13:09.050000,أبو سعود,واحدة من أكثر الأشياء المزعجة في الاتحاد، كيف تفقد نجومك مو لهذا الموسم اللي ثلاثة سنوات قدام لمنافسك الأول. كيف يجي كذا يفرغ دكتك، يأخذ سعود عبدالحميد قدامك ويأخذ عبدالإله المالكي في وقت أنت تفقد واحد مثل عبدالكريم الأحمدي في إصابة المفصل تفقده إلى نهاية الموسم. أنت فقدت ثلاثة كذا أساسيين قدامك محورين وظهيرك الأيمن من عشرة سنوات,4844000,4439000
10218.wav,هلال دياز بالعلامة الكاملة,01:11:36.480000,01:11:40.810000,عبيدالله العيسي,ممكن يكون فكَّر فيها بعد ضمان التأهل.,4776000,5110000
7.wav,حملة ضد مونديال قطر,00:01:14.100000,00:01:24.030000,Speaker 3,منظمة 2020 كأس العالم هي دولة قطر,174000,114000
3215.wav,أسرار إدارة صفقات كرة القدم مع وكيل لاعبين,00:14:40.520000,00:14:42.740000,وليد الرشيد,لا، الحين هم...,1400000,1622000